<xs:schema xmlns:xs="http://www.w3.org/2001/XMLSchema">
	<xs:element name="MARKERS">
		<xs:complexType>
			<xs:sequence>
				<xs:element name="MARKER" maxOccurs="unbounded">
					<xs:complexType>
						<xs:sequence>
							<xs:element name="TITLE" type="xs:string"/>
							<xs:element name="LATITUDE" type="xs:double"/>
							<xs:element name="LONGITUDE" type="xs:double"/>
						</xs:sequence>
					</xs:complexType>
				</xs:element>
			</xs:sequence>
		</xs:complexType>
	</xs:element>
</xs:schema>
